title,url,price
Responsive HTML/CSS Web Page Updates -- 2,https://www.freelancer.pk/projects/web-development/responsive-html-css-web-page,$221 (Avg Bid)
Texas Based APEX Application Enhancements -- 2,https://www.freelancer.pk/projects/java/texas-based-apex-application,$8 - $15 / hr
WHM & cPanel Specialist Setup,https://www.freelancer.pk/projects/cpanel/whm-cpanel-specialist-setup,$417 (Avg Bid)
Bookstore Web Development using asp.net/sqlite with Admin Interface and customer interface,https://www.freelancer.pk/projects/dot-net/bookstore-web-development-using-asp,$189 (Avg Bid)
AI Economic Intelligence & News Platform,https://www.freelancer.pk/projects/data-analysis/economic-intelligence-news-platform,$198 (Avg Bid)
Web Development Intern Needed,https://www.freelancer.pk/projects/web-development/web-development-intern-needed,$4 / hr (Avg Bid)
Implement Google Authentication on Filotchila,https://www.freelancer.pk/projects/google-apis/implement-google-authentication,$20 (Avg Bid)
Red Chilli Trade Web App,https://www.freelancer.pk/projects/web-application/red-chilli-trade-web-app,$302 (Avg Bid)
Real Estate Data Scraping,https://www.freelancer.pk/projects/data-scraping/real-estate-data-scraping,$72 (Avg Bid)
Modern Career Coaching Website Development,https://www.freelancer.pk/projects/web-development/modern-career-coaching-website,$94 (Avg Bid)
Comprehensive Web and App Redesign,https://www.freelancer.pk/projects/ui-design/comprehensive-web-app-redesign,$82 (Avg Bid)
Account Checker Tool Development,https://www.freelancer.pk/projects/web-development/account-checker-tool-development,$239 (Avg Bid)
Secure Digital Documentation & Workflow System,https://www.freelancer.pk/projects/full-stack-development/secure-digital-documentation-workflow,$6410 (Avg Bid)
Business Name & Website Creation,https://www.freelancer.pk/projects/branding/business-name-website-creation,$467 (Avg Bid)
User Subscription & API Verification Web App,https://www.freelancer.pk/projects/api-integration/user-subscription-api-verification-web,$2649 (Avg Bid)
Web Dev & Design Expert,https://www.freelancer.pk/projects/web-development/web-dev-design-expert,$58 / hr (Avg Bid)
Website Data Extraction to Excel,https://www.freelancer.pk/projects/data-extraction/website-data-extraction-excel,$22 (Avg Bid)
Customer Informative Copywriting,https://www.freelancer.pk/projects/copywriting/customer-informative-copywriting,$262 (Avg Bid)
AI-Based Web App for File Transformations,https://www.freelancer.pk/projects/ai-hw-sw/based-web-app-for-file,$524 (Avg Bid)
3D Real Estate Map Integration,https://www.freelancer.pk/projects/3d-design/real-estate-map-integration,$143 (Avg Bid)
looking for google or facebook ad expert for web design agency with proven results,https://www.freelancer.pk/projects/google-ads/looking-for-google-facebook-expert,$38 (Avg Bid)
Volunteer Registration and Lost & Found Platform,https://www.freelancer.pk/projects/web-development/volunteer-registration-lost-found,$251 (Avg Bid)
Web App Development with Telegram Integration,https://www.freelancer.pk/projects/android/web-app-development-with-telegram,$2280 (Avg Bid)
Professional Bilingual Startup Website,https://www.freelancer.pk/projects/web-development/professional-bilingual-startup-website,$217 (Avg Bid)
Replit/AWS Web Application Developer Needed,https://www.freelancer.pk/projects/replit/replit-aws-web-application-developer,$304 (Avg Bid)
Full-Stack Web Development Tutor - Hourly Coaching,https://www.freelancer.pk/projects/full-stack-web-development-tutor,$9 / hr (Avg Bid)
WordPress UberMenu Setup,https://www.freelancer.pk/projects/web-development/wordpress-ubermenu-setup,$24 (Avg Bid)
App Data Entry Specialist,https://www.freelancer.pk/projects/mobile-app-development/app-data-entry-specialist,$2 / hr (Avg Bid)
Dynamic Map Integration with Google Sheets,https://www.freelancer.pk/projects/web-development/dynamic-map-integration-with-google,$197 (Avg Bid)
Christmas Lighting Website,https://www.freelancer.pk/projects/web-design/christmas-lighting-website,$160 (Avg Bid)
Website Contest Tab Creation,https://www.freelancer.pk/projects/web-development/website-contest-tab-creation,$21 (Avg Bid)
G1 Test Ontario Practice Website,https://www.freelancer.pk/projects/web-development/test-ontario-practice-website,$399 (Avg Bid)
Private Practice Webpage Development,https://www.freelancer.pk/projects/web-development/private-practice-webpage-development,$456 (Avg Bid)
Australian Product Info Scraping,https://www.freelancer.pk/projects/data-collection/australian-product-info-scraping,$1336 (Avg Bid)
Brazilian Speaking PHP/CodeIgniter Dev for Web App MVP,https://www.freelancer.pk/projects/mysql/php-codeigniter-dev-for-web,$15 / hr (Avg Bid)
Private project or contest #2608492,"https://www.freelancer.pk/login?goto=NGI4YzNiYTY5ODUyYWM0ZDA1MzQzZDYzYjU1YmJmNDdodHRwczovL3d3dy5mcmVlbGFuY2VyLnBrL2NvbnRlc3QvLTI2MDg0OTI,",N/A
Zoho-Integrated Video Dashboard Development,https://www.freelancer.pk/projects/zoho/zoho-integrated-video-dashboard,$473 (Avg Bid)
Azure Setup & Monitoring VA Needed,https://www.freelancer.pk/projects/azure/azure-setup-monitoring-needed,$469 (Avg Bid)
Professional Product Visuals Needed,https://www.freelancer.pk/projects/photography/professional-product-visuals-needed,$750 - $1500
Structured Data Implementation for Cabinets4sure.com,https://www.freelancer.pk/projects/web-development/structured-data-implementation-for,$21 / hr (Avg Bid)
Elegant Scrolling Animation Website,https://www.freelancer.pk/projects/animation/elegant-scrolling-animation-website,$12 (Avg Bid)
Business Operations App,https://www.freelancer.pk/projects/api-developmet/business-operations-app,$854 (Avg Bid)
Stock Sync Web App,https://www.freelancer.pk/projects/api/stock-sync-web-app,$157 (Avg Bid)
Expert Web Designer for Conversion-Focused Real Estate Site,https://www.freelancer.pk/projects/wordpress/expert-web-designer-for-conversion,$428 (Avg Bid)
Podiatry Appointment Booking Website,https://www.freelancer.pk/projects/css/podiatry-appointment-booking-website,$1994 (Avg Bid)
X-Frame-Options Bypass,https://www.freelancer.pk/projects/web-development/frame-options-bypass,$24 (Avg Bid)
CodeIgniter PDF Report Fix,https://www.freelancer.pk/projects/web-development/codeigniter-pdf-report-fix,$28 (Avg Bid)
Anontalk Anonymous Web App Development,https://www.freelancer.pk/projects/web-development/anontalk-anonymous-web-app-development,$115 (Avg Bid)
AI-Powered Business Website Development,https://www.freelancer.pk/projects/ai-chatbot-development/powered-business-website-development,$23 / hr (Avg Bid)
High-Impact Landing Page & Interactive Chatbot for Government Contract Expert,https://www.freelancer.pk/contest/highimpact-landing-page-amp-interactive-chatbot-for-government-contract-expert-2608435,$30
